{
  "format": "method-report/1",
  "episodes": 836,
  "rows": [
    {
      "row": "realtime/calm/high-trust",
      "proposer": "mcts",
      "episodes": 44,
      "ticks": 191,
      "share": 0.9845,
      "predicted_mean": 0.0099,
      "realized_mean": 0.0057,
      "abs_error": 0.0109,
      "success_rate": 0.5909,
      "clear_rate": 1,
      "wall_p50_ms": 254.062,
      "wall_p95_ms": 469.628
    },
    {
      "row": "realtime/calm/high-trust",
      "proposer": "reactive",
      "episodes": 1,
      "ticks": 3,
      "share": 0.0155,
      "predicted_mean": 0,
      "realized_mean": 0,
      "abs_error": 0,
      "success_rate": 0,
      "clear_rate": 1,
      "wall_p50_ms": 131.752,
      "wall_p95_ms": 131.752
    },
    {
      "row": "realtime/calm/low-trust",
      "proposer": "experiment",
      "episodes": 4,
      "ticks": 4,
      "share": 0.003,
      "predicted_mean": 0.0837,
      "realized_mean": 0,
      "abs_error": 0.0837,
      "success_rate": 0,
      "clear_rate": 1,
      "wall_p50_ms": 71.034,
      "wall_p95_ms": 87.925
    },
    {
      "row": "realtime/calm/low-trust",
      "proposer": "mcts",
      "episodes": 292,
      "ticks": 1230,
      "share": 0.9255,
      "predicted_mean": 0.0234,
      "realized_mean": 0.0048,
      "abs_error": 0.0245,
      "success_rate": 0.4007,
      "clear_rate": 1,
      "wall_p50_ms": 81.766,
      "wall_p95_ms": 124.83
    },
    {
      "row": "realtime/calm/low-trust",
      "proposer": "reactive",
      "episodes": 30,
      "ticks": 95,
      "share": 0.0715,
      "predicted_mean": 0.0608,
      "realized_mean": 0.004,
      "abs_error": 0.0571,
      "success_rate": 0.0333,
      "clear_rate": 1,
      "wall_p50_ms": 86.81,
      "wall_p95_ms": 106.655
    },
    {
      "row": "realtime/threat/high-trust",
      "proposer": "experiment",
      "episodes": 9,
      "ticks": 19,
      "share": 0.02,
      "predicted_mean": 0.0163,
      "realized_mean": 0,
      "abs_error": 0.0163,
      "success_rate": 0,
      "clear_rate": 1,
      "wall_p50_ms": 373.3,
      "wall_p95_ms": 578.791
    },
    {
      "row": "realtime/threat/high-trust",
      "proposer": "mcts",
      "episodes": 155,
      "ticks": 687,
      "share": 0.7247,
      "predicted_mean": 0.0263,
      "realized_mean": 0.0056,
      "abs_error": 0.0271,
      "success_rate": 0.0581,
      "clear_rate": 1,
      "wall_p50_ms": 395.539,
      "wall_p95_ms": 619.628
    },
    {
      "row": "realtime/threat/high-trust",
      "proposer": "reactive",
      "episodes": 54,
      "ticks": 242,
      "share": 0.2553,
      "predicted_mean": 0.0456,
      "realized_mean": 0.051,
      "abs_error": 0.0189,
      "success_rate": 0.2778,
      "clear_rate": 1,
      "wall_p50_ms": 354.337,
      "wall_p95_ms": 578.999
    },
    {
      "row": "realtime/threat/low-trust",
      "proposer": "experiment",
      "episodes": 9,
      "ticks": 13,
      "share": 0.0118,
      "predicted_mean": 0.0366,
      "realized_mean": -0.0014,
      "abs_error": 0.0381,
      "success_rate": 0,
      "clear_rate": 1,
      "wall_p50_ms": 92.35,
      "wall_p95_ms": 152.092
    },
    {
      "row": "realtime/threat/low-trust",
      "proposer": "mcts",
      "episodes": 146,
      "ticks": 656,
      "share": 0.5931,
      "predicted_mean": 0.0526,
      "realized_mean": -0.0051,
      "abs_error": 0.0584,
      "success_rate": 0.1027,
      "clear_rate": 1,
      "wall_p50_ms": 115.953,
      "wall_p95_ms": 170.548
    },
    {
      "row": "realtime/threat/low-trust",
      "proposer": "reactive",
      "episodes": 92,
      "ticks": 437,
      "share": 0.3951,
      "predicted_mean": 0.0393,
      "realized_mean": -0.0061,
      "abs_error": 0.0455,
      "success_rate": 0.0109,
      "clear_rate": 1,
      "wall_p50_ms": 117.604,
      "wall_p95_ms": 167.563
    }
  ],
  "proposer_share": {
    "experiment": 0.0101,
    "mcts": 0.7727,
    "reactive": 0.2172
  },
  "rule_share": {
    "goap+mcts:mcts": 1
  }
}
